#,Actor,Alcance,Categoria,Justificacion_Inclusion,Mendelow,Interes,Justificacion_Interes,Poder,Justificacion_Poder,Legitimidad,Justificacion_Legitimidad,Urgencia,Justificacion_Urgencia,Capacidad_Articulacion,Justificacion_Articulacion,Genero,Justificacion_Genero
87.0,Instituto Nacional de Normalización (INN),Chile," Normalización, certificación y acreditación","Organismo nacional encargado del desarrollo y adopción de normas técnicas en Chile. Su participación es relevante para apoyar la construcción de estándares, requisitos técnicos y lineamientos que faciliten la implementación segura de procesos de reconversión vehicular.",Hacer seguimiento,4.0,"Podría participar en el desarrollo de estándares y requisitos técnicos asociados al retrofit, pero se trata de una actividad complementaria dentro de sus múltiples responsabilidades.",6.0,"Puede influir en la creación y adopción de estándares aplicables a tecnologías retrofit, aunque su capacidad es principalmente técnica y no regulatoria.",,,,,,,5.0,"Puede contribuir mediante la incorporación de enfoques de inclusión dentro de procesos de normalización y estándares técnicos, aunque de forma indirecta."
88.0,Instituto Nacional de Calidad (INACAL),Perú," Normalización, certificación y acreditación","Entidad responsable de promover la calidad, la normalización y la acreditación en Perú. Su participación contribuye al fortalecimiento de marcos técnicos y procedimientos de evaluación necesarios para el desarrollo de soluciones retrofit compatibles con los estándares nacionales e internacionales.",Hacer seguimiento,4.0,"El retrofit representa una posible aplicación de sus actividades de calidad, normalización y acreditación, aunque no constituye una prioridad central para la institución.",6.0,"Tiene influencia sobre procesos de calidad, normalización y acreditación que pueden apoyar el desarrollo del mercado retrofit en Perú.",,,,,,,5.0,"Tiene capacidad para incorporar principios de inclusión en procesos de calidad y fortalecimiento institucional, aunque sin una función específica en materia de género."
89.0,SGS,Regional Latinoamérica," Normalización, certificación y acreditación","Organismo internacional especializado en inspección, certificación y verificación. Su experiencia en evaluación de tecnologías, seguridad industrial y cumplimiento normativo aporta capacidades relevantes para apoyar procesos de certificación asociados al retrofit vehicular.",Hacer seguimiento,6.0,"La expansión del retrofit podría generar demanda por servicios de inspección, pruebas y certificación técnica. Existe interés comercial, aunque el mercado retrofit representa solo una parte menor de su actividad global.",6.0,"Como empresa global de certificación e inspección, puede contribuir a validar tecnologías y generar confianza en el mercado, aunque no posee capacidad para modificar políticas públicas.",,,,,,,7.0,"Como empresa global de certificación cuenta con políticas corporativas de diversidad e inclusión que pueden influir sobre clientes, proveedores y procesos de evaluación organizacional."
90.0,TÜV Rheinland,Regional Latinoamérica," Normalización, certificación y acreditación","Empresa global especializada en inspección, certificación y evaluación de conformidad. Su participación es relevante para aportar experiencia en validación técnica de tecnologías, homologación y verificación de estándares de seguridad aplicables a vehículos reconvertidos.",Hacer seguimiento,6.0,"La homologación, validación y evaluación de tecnologías retrofit puede generar nuevas oportunidades de servicios, pero el retrofit constituye únicamente uno de muchos mercados atendidos por la organización.",6.0,Su reconocimiento internacional en certificación y evaluación técnica le permite influir en estándares de calidad y seguridad aplicables a procesos de retrofit vehicular.,,,,,,,7.0,Dispone de programas corporativos de diversidad e inclusión y capacidad para promover buenas prácticas laborales y organizacionales en múltiples sectores industriales.
91.0,Bureau Veritas,Regional Latinoamérica," Normalización, certificación y acreditación","Organismo internacional de inspección y certificación con amplia experiencia en los sectores transporte, energía e industria. Su participación permite fortalecer la evaluación técnica, la confiabilidad de las soluciones retrofit y la adopción de buenas prácticas internacionales.",Hacer seguimiento,6.0,"La empresa puede beneficiarse de actividades relacionadas con certificación, inspección y evaluación de conformidad para vehículos reconvertidos, aunque no depende directamente del crecimiento de este mercado.",6.0,"Posee capacidades relevantes de certificación, inspección y evaluación de conformidad que pueden contribuir a la validación técnica de tecnologías retrofit, aunque su influencia sobre las decisiones de mercado es indirecta.",,,,,,,7.0,"Como empresa global de certificación e inspección cuenta con políticas corporativas de diversidad, equidad e inclusión que pueden influir sobre organizaciones cliente y cadenas de suministro en múltiples sectores productivos."
92.0,ANDI,Colombia, Gremio o asociación sectorial,"Principal gremio empresarial de Colombia con capacidad de articulación entre gobierno, industria y actores del sector transporte y energético. Su participación es relevante para identificar barreras de mercado, promover diálogo sectorial y facilitar la adopción de tecnologías asociadas al retrofit vehicular.",Mantener satisfecho,6.0,"Tiene interés en iniciativas que fortalezcan la competitividad industrial, la innovación y la transición tecnológica, pero representa sectores diversos cuyos intereses frente al retrofit pueden ser heterogéneos.",7.0,"Es uno de los gremios empresariales más influyentes de Colombia y tiene capacidad para articular al sector privado, influir en discusiones regulatorias y posicionar iniciativas relacionadas con movilidad sostenible.",,,,,,,8.0,"Como principal gremio empresarial de Colombia tiene capacidad para promover agendas de diversidad e inclusión entre sus afiliados, influir en política pública y difundir buenas prácticas empresariales en materia de género."
93.0,ANDEMOS,Colombia, Gremio o asociación sectorial,"Gremio que representa a fabricantes e importadores de vehículos en Colombia. Su participación es importante para comprender la perspectiva del sector automotor, identificar oportunidades de innovación tecnológica y promover condiciones favorables para la adopción de soluciones de retrofit.",Hacer seguimiento,6.0,"La evolución tecnológica del sector automotor puede generar oportunidades para algunos de sus afiliados. Sin embargo, existen posiciones diversas entre actores que podrían beneficiarse más de la venta de vehículos nuevos.",6.0,"Puede representar los intereses de fabricantes e importadores ante entidades públicas y participar en la construcción de marcos regulatorios, aunque su influencia depende del nivel de alineación de sus afiliados.",,,,,,,7.0,Puede promover estándares sectoriales de inclusión y fortalecer la participación femenina dentro de la industria automotriz colombiana a través de iniciativas gremiales y espacios de articulación empresarial.
94.0,ASOBUS,Colombia, Gremio o asociación sectorial,"Asociación que representa empresas relacionadas con la operación de transporte en bus. Su participación permite incorporar la visión de los operadores, identificar necesidades del sector y promover estrategias de modernización de flotas compatibles con los objetivos del retrofit vehicular.",Mantener satisfecho,8.0,"Representa operadores de transporte de pasajeros que podrían beneficiarse directamente de soluciones retrofit para modernizar flotas, reducir emisiones y optimizar costos de renovación vehicular.",7.0,"Representa operadores de transporte de pasajeros que constituyen potenciales usuarios del retrofit, otorgándole capacidad para influir en discusiones sectoriales y promover posiciones comunes.",,,,,,,7.0,"Representa a operadores de transporte de pasajeros y puede impulsar buenas prácticas de inclusión laboral, formación de mujeres conductoras y participación femenina en actividades operativas."
95.0,Colfecar,Colombia, Gremio o asociación sectorial,"Gremio representativo del sector transporte de carga en Colombia. Su participación es relevante debido al potencial futuro de las tecnologías retrofit para flotas comerciales y a su capacidad para aportar información sobre requerimientos operativos, regulatorios y económicos del sector transporte.",Hacer seguimiento,4.0,Su interés es limitado debido a que el foco principal del estudio es transporte público urbano. El retrofit de buses tiene una relación indirecta con las prioridades actuales del transporte de carga.,4.0,"Aunque es un gremio relevante dentro del transporte de carga, su capacidad de incidencia sobre el retrofit de buses urbanos es limitada y principalmente indirecta.",,,,,,,5.0,"Aunque tiene capacidad de incidencia gremial, su agenda principal se concentra en transporte de carga y logística, donde las iniciativas de género aún tienen menor visibilidad relativa."
96.0,AMIA,México, Gremio o asociación sectorial,"Asociación Mexicana de la Industria Automotriz, representante de fabricantes de vehículos en México. Su participación resulta relevante para identificar tendencias de mercado, conocer la visión de la industria automotriz y promover la articulación entre fabricantes y actores vinculados al retrofit vehicular.",Hacer seguimiento,4.0,Representa fabricantes automotrices cuyo negocio principal se basa en la comercialización de vehículos nuevos. En algunos casos el retrofit puede incluso competir con procesos tradicionales de renovación vehicular.,6.0,"Representa a fabricantes automotrices con capacidad de interlocución ante el gobierno mexicano y otros actores sectoriales, aunque no todos sus afiliados comparten incentivos para impulsar el retrofit.",,,,,,,7.0,"Como representante de la industria automotriz mexicana puede incentivar la adopción de prácticas de diversidad e inclusión entre fabricantes, distribuidores y empresas afiliadas."
97.0,ANPACT,México, Gremio o asociación sectorial,Asociación que representa a fabricantes de vehículos pesados y autobuses en México. Su participación es estratégica debido a su conocimiento técnico del sector y a su capacidad para apoyar la evaluación de soluciones de reconversión tecnológica en flotas de transporte público.,Mantener satisfecho,6.0,"Representa fabricantes de autobuses y vehículos pesados en México. Aunque existen intereses asociados a la transformación tecnológica del sector, no todos sus afiliados se benefician directamente del crecimiento del retrofit.",7.0,Agrupa a fabricantes de autobuses y vehículos pesados con capacidad de influencia técnica y sectorial sobre decisiones relacionadas con la modernización tecnológica del transporte.,,,,,,,8.0,"Agrupa a los principales fabricantes de vehículos pesados y autobuses de México, por lo que puede generar transformaciones significativas en empleo femenino, formación técnica y diversidad sectorial."
98.0,Electromovilidad Asociación A.G.,Chile, Gremio o asociación sectorial,"Asociación especializada en promover el desarrollo de la electromovilidad en Chile. Su participación aporta conocimiento técnico, experiencias sectoriales y capacidades de articulación que pueden acelerar la adopción de tecnologías de bajas emisiones y soluciones retrofit en el transporte público.",Mantener satisfecho,8.0,La organización promueve activamente la adopción de tecnologías de movilidad eléctrica. El retrofit puede convertirse en una herramienta complementaria para acelerar la descarbonización del transporte.,7.0,"Actúa como articulador del ecosistema de electromovilidad en Chile y puede influir en debates técnicos, regulatorios y comerciales relacionados con tecnologías de transición energética.",,,,,,,8.0,"Promueve activamente el desarrollo de la electromovilidad en Chile y tiene capacidad para incorporar criterios de género e inclusión dentro de las agendas de innovación, transición tecnológica y desarrollo de talento."
99.0,ANAC Chile,Chile, Gremio o asociación sectorial,"Asociación Nacional Automotriz de Chile, representante de fabricantes e importadores de vehículos. Su participación es relevante para aportar la visión de la industria automotriz, identificar oportunidades de innovación tecnológica y facilitar el diálogo sobre la transición hacia sistemas de movilidad más sostenibles.",Hacer seguimiento,4.0,"Representa fabricantes e importadores de vehículos, muchos de los cuales concentran su estrategia comercial en la venta de unidades nuevas. Su interés en retrofit es relativamente limitado frente a otras alternativas de mercado.",6.0,"Representa a fabricantes e importadores con capacidad de influencia sectorial, aunque el retrofit no necesariamente se encuentra alineado con los intereses de todos sus miembros.",,,,,,,6.0,"Puede sensibilizar e influir sobre empresas automotrices respecto a la incorporación de políticas de diversidad e inclusión, aunque no constituye una prioridad histórica de la organización."
100.0,Asociación Automotriz del Perú (AAP),Perú, Gremio o asociación sectorial,"Entidad representativa del sector automotor peruano que agrupa a fabricantes, importadores y actores de la industria. Su participación es importante para comprender las dinámicas del mercado, identificar barreras para la adopción de nuevas tecnologías y apoyar la construcción de estrategias de retrofit vehicular en el país.",Hacer seguimiento,4.0,"La organización tiene interés general en la evolución del sector automotor, pero la reconversión vehicular no constituye actualmente uno de sus principales focos de actuación.",6.0,"Tiene capacidad de interlocución con autoridades y empresas del sector automotor peruano, pudiendo influir en discusiones sobre modernización vehicular y nuevas tecnologías.",,,,,,,6.0,Tiene capacidad para promover buenas prácticas de inclusión dentro del sector automotor peruano y apoyar iniciativas que fortalezcan la participación femenina en la industria.
101.0,Bancóldex,Colombia, Banca de desarrollo y financiamiento,"Entidad financiera de desarrollo empresarial de Colombia con capacidad para estructurar líneas de crédito, instrumentos financieros y programas de apoyo orientados a la modernización tecnológica. Su participación es relevante para facilitar el acceso a financiamiento de proyectos de retrofit y transición hacia flotas de bajas emisiones.",Manejar de cerca,8.0,La entidad puede desempeñar un papel relevante en la estructuración de líneas de crédito y mecanismos financieros para viabilizar proyectos de retrofit. El desarrollo de este mercado representa una oportunidad clara para promover inversión en tecnologías limpias y modernización empresarial.,8.0,"Puede estructurar líneas de crédito, instrumentos financieros y programas específicos que faciliten la adopción de tecnologías retrofit por parte de operadores y empresas de transporte.",6.0,Entidad financiera pública reconocida por su experiencia en desarrollo empresarial y financiación de procesos de transformación productiva.,5.0,"Aunque puede desempeñar un papel importante en el financiamiento de proyectos de electromovilidad, no se observan actualmente iniciativas emblemáticas de electromovilidad lideradas directamente por la entidad.",7.0,"Puede reunir empresas, entidades públicas y actores financieros alrededor de instrumentos de financiación para innovación, sostenibilidad y transición tecnológica.",8.0,"Como banca pública de desarrollo tiene capacidad para incorporar criterios de género en líneas de crédito, programas empresariales y mecanismos de financiamiento vinculados a transición energética, innovación y movilidad sostenible. Además, puede condicionar instrumentos financieros para promover mayor participación femenina en sectores productivos."
102.0,Findeter,Colombia, Banca de desarrollo y financiamiento,Banca de desarrollo colombiana especializada en financiación de infraestructura y desarrollo territorial. Su participación es importante para estructurar mecanismos de financiamiento que impulsen la renovación y reconversión tecnológica de flotas de transporte público urbano.,Manejar de cerca,8.0,"La modernización de flotas urbanas se alinea con sus objetivos de financiamiento de infraestructura y desarrollo territorial, lo que genera un interés significativo en soluciones que contribuyan a la sostenibilidad del transporte.",8.0,Tiene capacidad para movilizar recursos financieros hacia proyectos de transporte sostenible y apoyar esquemas de modernización de flotas mediante mecanismos de financiación especializados.,6.0,"Institución financiera de desarrollo con credibilidad en proyectos de infraestructura, transporte y desarrollo territorial.",4.0,"Mantiene capacidad para apoyar proyectos de transporte sostenible, pero la electromovilidad no aparece actualmente como una de sus líneas de actuación más visibles o urgentes.",8.0,"Posee amplia experiencia en la estructuración de proyectos territoriales complejos que requieren coordinación entre gobiernos, empresas, financiadores y organismos de cooperación.",8.0,"La entidad ha incorporado criterios de sostenibilidad e inclusión en diversos programas de desarrollo territorial. Su capacidad de estructuración y asistencia técnica le permite promover enfoques de género en proyectos de movilidad, infraestructura y desarrollo urbano."
103.0,Financiera de Desarrollo Nacional (FDN),Colombia, Banca de desarrollo y financiamiento,"Entidad financiera especializada en estructuración y financiamiento de proyectos de infraestructura en Colombia. Su participación resulta relevante para apoyar modelos de negocio, esquemas de inversión y mecanismos financieros que permitan escalar programas de retrofit vehicular.",Manejar de cerca,8.0,"El retrofit puede generar oportunidades para estructurar esquemas de financiamiento innovadores en transporte sostenible, particularmente cuando se desarrollen proyectos de gran escala asociados a flotas urbanas.",8.0,Posee capacidades de estructuración financiera e influencia sobre proyectos estratégicos de infraestructura y transporte que pueden facilitar el escalamiento del retrofit.,6.0,"Entidad especializada en estructuración financiera de proyectos estratégicos, con legitimidad relevante en infraestructura y movilidad.",4.0,"Posee potencial para estructurar proyectos asociados a movilidad sostenible, aunque no se identifican iniciativas recientes de electromovilidad que justifiquen una urgencia superior.",8.0,Su modelo de trabajo exige coordinar múltiples actores públicos y privados para estructurar proyectos de infraestructura y transporte de gran escala.,7.0,"Aunque su foco principal es la estructuración financiera de proyectos, puede contribuir a incorporar criterios de inclusión y diversidad en iniciativas de infraestructura y transporte de gran escala."
104.0,Nacional Financiera (NAFIN),México, Banca de desarrollo y financiamiento,Institución financiera de desarrollo de México con experiencia en financiamiento empresarial e innovación tecnológica. Su participación es relevante para promover instrumentos financieros que faciliten la adopción de tecnologías de bajas emisiones y proyectos de reconversión vehicular.,Mantener satisfecho,7.0,"Tiene interés en promover innovación y competitividad empresarial, aunque el retrofit representa solo una de múltiples alternativas de financiamiento vinculadas a la transición tecnológica.",7.0,Puede impulsar instrumentos crediticios y programas de apoyo empresarial orientados a tecnologías limpias y modernización del transporte en México.,,,,,,,8.0,"Como banca de desarrollo mexicana posee capacidad para impulsar programas de financiamiento empresarial con enfoque inclusivo, apoyar emprendimientos liderados por mujeres y promover mecanismos de acceso equitativo al financiamiento."
105.0,BANOBRAS,México, Banca de desarrollo y financiamiento,Banco nacional de obras y servicios públicos de México con amplia experiencia en financiamiento de infraestructura y transporte. Su participación es importante para impulsar inversiones que favorezcan la modernización de flotas y la implementación de tecnologías retrofit en sistemas de movilidad urbana.,Mantener satisfecho,7.0,"La modernización del transporte público puede requerir instrumentos de financiamiento compatibles con su misión institucional, aunque el retrofit no constituye actualmente una línea prioritaria específica.",7.0,Cuenta con capacidad para financiar iniciativas de transporte público e infraestructura urbana que podrían incorporar componentes asociados al retrofit vehicular.,,,,,,,7.0,"Tiene capacidad para incorporar criterios de inclusión en proyectos financiados de infraestructura y transporte, aunque la agenda de género no constituye históricamente uno de sus ejes más visibles."
106.0,CORFO,Chile, Banca de desarrollo y financiamiento,"Corporación de fomento de Chile dedicada a impulsar la innovación, la competitividad y el desarrollo productivo. Su participación es relevante para promover programas de financiamiento, innovación tecnológica y fortalecimiento empresarial vinculados a la reconversión de flotas y la electromovilidad.",Manejar de cerca,8.0,"La entidad tiene interés en iniciativas de innovación, desarrollo productivo y transición tecnológica. El retrofit puede generar oportunidades de emprendimiento, innovación y fortalecimiento industrial.",8.0,"Es una de las instituciones más influyentes de Chile en materia de innovación y desarrollo productivo, con capacidad para impulsar programas tecnológicos y mecanismos de apoyo al sector.",7.0,"Institución pública chilena ampliamente respetada en innovación y desarrollo productivo, con capacidad de influir sobre programas estratégicos nacionales.",8.0,"Continúa impulsando programas vinculados a innovación tecnológica, transición energética y desarrollo de ecosistemas asociados a electromovilidad en Chile. ",9.0,"Ha demostrado históricamente una alta capacidad para articular gobierno, empresas, academia, centros tecnológicos y organismos internacionales alrededor de agendas de innovación y desarrollo productivo.",9.0,"Es una de las instituciones más activas de la región en el impulso de innovación, emprendimiento y desarrollo productivo. Ha promovido programas específicos para fortalecer la participación de mujeres en ecosistemas de innovación y tecnologías emergentes."
107.0,COFIDE,Perú, Banca de desarrollo y financiamiento,Banco de desarrollo del Perú especializado en promover inversiones y apoyar proyectos estratégicos para el país. Su participación es relevante para facilitar mecanismos financieros que permitan acelerar la adopción de tecnologías retrofit y la modernización del transporte público.,Mantener satisfecho,7.0,"Puede apoyar mecanismos financieros para la modernización de flotas, aunque el retrofit compite con otras prioridades de inversión e infraestructura dentro de su ámbito de actuación.",7.0,Posee capacidad para facilitar financiamiento a proyectos estratégicos y promover instrumentos financieros vinculados a la modernización del transporte en Perú.,,,,,,,7.0,Como banca de desarrollo peruana puede promover acceso inclusivo al financiamiento y fortalecer la participación femenina en iniciativas empresariales y proyectos de transformación productiva.
108.0,Banco Interamericano de Desarrollo (BID),Regional Latinoamérica, Banca de desarrollo y financiamiento,"Organismo multilateral de desarrollo con amplia experiencia en movilidad sostenible, transición energética y cambio climático en América Latina. Su participación es estratégica para aportar financiamiento, asistencia técnica y conocimiento especializado que facilite la implementación de programas de retrofit vehicular.",Manejar de cerca,8.0,"La movilidad sostenible, la descarbonización y la transición energética forman parte de sus líneas estratégicas. El retrofit puede convertirse en una herramienta complementaria para alcanzar estos objetivos en la región.",8.0,"Tiene capacidad de movilizar recursos financieros, asistencia técnica y conocimiento especializado a escala regional, influyendo significativamente sobre agendas de movilidad sostenible.",8.0,Institución multilateral altamente reconocida cuyas metodologías y recomendaciones son frecuentemente consideradas por gobiernos y entidades públicas.,9.0,"Mantiene programas regionales de electromovilidad, financiamiento especializado y plataformas de apoyo a proyectos eléctricos de transporte en América Latina. ",10.0,"Posee una de las mayores capacidades de articulación de la región, convocando gobiernos, entidades financieras, organismos de cooperación, empresas y operadores alrededor de proyectos comunes.",10.0,"Es uno de los actores más influyentes de América Latina en materia de género e inclusión. Ha desarrollado metodologías, salvaguardas, indicadores y requisitos que permiten transversalizar el enfoque de género en programas de transporte, energía, infraestructura y desarrollo económico."
